#,اسم الفعالية,الجهة المسؤولة,وصف الفعالية,تاريخ البداية,تاريخ النهاية,عدد الأيام,التصنيف,النوع,المدينة,الفئة الفرعية,حالة الإضافة,التمويل,التواصل,فترة الإقامة,حالة التضمين,سبب الاستبعاد
,تجارب ريفية ,مؤسسة محمد عبدالله عبود,فعالية ريفية زراعية تعتمد على تجارب تفاعلية تتيح للزوار زراعة الشتلات و قطف الفواكه و تذوق العصائر الموسمية وتجربة تذوق فطور محلي واستخراج المربى وإعداد خبز التنور و الأطباق المحلية والتصوير بالزي التراثي.,"Wednesday, June 24, 2026","Tuesday, September 1, 2026",70,Tier 2,ترفيه,عسير,,أساس,لم تلغى,متواصلة,خلال التواريخ المحددة,تضمن,
,مهرجان ماجيك فير ,شركة أربعة مواسم للترفيه,مهرجان ماجيك فير فعالية ترفيهية عائلية تضم ألعابًا أوروبية وعروضًا متنوعة وأنشطة تفاعلية مخصصة للزوار من مختلف الأعمار وقد أُقيمت الفعالية سابقًا في عدد من المدن السعودية منها جيزان وأبها والأحساء والظهران.,"Thursday, June 25, 2026","Sunday, August 30, 2026",75,Tier 3,ترفيه,عسير,,أساس,لم تلغى,متواصلة,خلال التواريخ المحددة,تحسب بدون تضمين,Tier 3
,فعالية سيّر ,هيئة تطوير  منطقة عسير ,"تجربة ملهمة تجمع بين روح المغامرة وجمال الطبيعة حيث تتكون الفعالية من عدة مناطق ترفيهية، تقدم كل منطقة أنشطة مختلفة تشمل على أنشطة حركية ورياضية مثل المشي في المسارات والتسلق والبادل والفروسية، إضافة إلى مناطق مخصصة للتخييم وورش العمل والعروض الموسيقية الحية وتجارب اليوغا والطهي المحلي، كما تضم الفعالية منطقة خاصة توفر أكواخًا مستقلة بجلسات داخلية وخارجية.","Thursday, June 25, 2026","Tuesday, September 1, 2026",69,Tier 2,ترفيه,عسير,,أساس,لم تلغى,متواصلة,خلال التواريخ المحددة,تضمن,
,تفعيلات وِرث,المعهد الملكي للفنون التقليدية ,فعالية ومعكسر ورث تعد فعالية مجتمعية تجمع بين تجربة الفعاليات والمعسكرات التعليمية وتقدّم برنامجًا تفاعليًا لاكتشاف الفنون التقليدية عبر محطات إبداعية وورش تطبيقية يمارس فيها المشاركون الحرف المحلية وينتجون أعمالًا فنية تعكس الموروث الثقافي مع أنشطة جماعية وتجارب ميدانية.,"Thursday, July 23, 2026","Sunday, August 30, 2026",34,Tier 2,ترفيه,عسير,,أساس,لم تلغى,غير متواصلة,خلال التواريخ المحددة,تضمن,
,معسكر تفعيلات  وِرث - أبها | النسخة الثالثة,المعهد الملكي للفنون التقليدية ,يعد أول برنامج سعودي تدريبي وتعليمي متخصّص في مجال الفنون التقليدية حيث يوفّر تجربة متكاملة تهدف إلى صقل المهارات الحسية وتنمية الشخصية القيادية لـ 50 مشاركًا من مختلف أنحاء المملكة.يقدّم المعسكر مزيجًا من الأنشطة التفاعلية والتجارب الملهمة تشمل على ورش عمل نظرية وعملية في الفنون التقليدية أعمال فنية جماعية تنمّي روح الفريق والإبداع وزيارات ميدانية وتفعيلات مصاحبة للتعرّف على الحرف المحلية وتجربة مبيت في أجواء طبيعية تعكس أصالة المنطقة وتنوّع بيئتها يمثل معسكر وِرث منصة لتمكين المواهب الوطنية وإحياء الموروث الثقافي عبر دمج الحرف التقليدية بالأساليب المعاصرة وتعزيز الوعي المجتمعي بأهمية الفنون اليدوية في مختلف مناطق المملكة. ,"Saturday, August 1, 2026","Sunday, August 30, 2026",30,Tier 3,ترفيه,عسير,,أساس,لم تلغى,متواصلة,خلال التواريخ المحددة,لن تضمن,Tier 3
,مهرجان المونودراما,هيئة المسرح والفنون الأدائية,مهرجان محلي يختص بعروض المونودراما (عرض مسرحي يقدمه ممثل واحد يروي قصة متكاملة بأسلوب إبداعي وحضور مؤثر) حيث تتنافس العروض المسرحية المشاركة في مسابقة المهرجان على جوائزه المختلفة مستهدفةَ حضور المسرحيين والمثقفين والنقّاد والجمهور العام. ,"Saturday, September 5, 2026","Wednesday, September 9, 2026",5,Tier 3,ترفيه,عسير,,أساس,لم تلغى,متواصلة,خلال التواريخ المحددة,تحسب بدون تضمين,Tier 3
,تفعيلات اليوم الوطني,هيئة المكتبات,"فعاليات اليوم الوطني السعودي احتفاءً بمسيرة الوطن ووحدته التي أرسى دعائمها الملك عبدالعزيز بن عبدالرحمن آل سعود – طيب الله ثراه – عام 1351هـ / 1932م، في أجواء تفيض فخرًا واعتزازًا بالهوية السعودية.تتضمن الفعاليات عروضًا فنية ووطنية وأركانًا تفاعلية ومعارض تُبرز إنجازات المملكة وتاريخها المشرق إلى جانب مشاركات مجتمعية تعبّر عن روح الولاء والانتماء وتهدف هذه الفعالية إلى تعزيز القيم الوطنية واستحضار مسيرة النماء والازدهاروالاحتفاء بماضي المملكة العريق وحاضرها الزاهر ومستقبلها الواعد.","Wednesday, September 23, 2026","Wednesday, September 23, 2026",1,Tier 3,ترفيه,عسير,,أساس,لم تلغى,متواصلة,خلال التواريخ المحددة,تحسب بدون تضمين,Tier 3
,رحلة في الإرث الإقليمي,هيئة المتاحف,تهدف الفعالية الى توسيع نطاق رؤية هيئة المتاحف وتعزيز الشراكات الإقليمية عبر المملكة من خلال سلسلة برامج متنقلة تقدّم رؤى متحفيه متخصصة وموجهة للجمهور. ينقسم البرنامج إلى ثلاثة محاور رئيسية(العمارة المادية والمجموعات الحية والتاريخ البحري والسرد القصصي التوثيق الحضري والذاكرة المعمارية) يركّز كل منها على توثيق وتحويل الإرث المحلي إلى مجموعات حية (Living Collections) تُثري المشهد الثقافي وتوسّع التفاعل مع الشركاء الإقليميين.,"Thursday, October 1, 2026","Thursday, October 15, 2026",15,Tier 3,ترفيه,عسير,,أساس,لم تلغى,متواصلة,خلال التواريخ المحددة,تحسب بدون تضمين,Tier 3
,أطفالنا يقرؤون,هيئة المكتبات, فعالية تفاعلية تهدف إلى تعزيز حب القراءة لدى الأطفال من عمر 5 إلى 15 عامًا عبر أنشطة متنوعة تحفّز الخيال وتفتح أبواب المعرفة مع ورش مخصصة لأولياء الأمور لدعم بناء عادات قرائية مستدامة. تجربة تجمع بين المتعة والتعليم في بيئة محفزة للإبداع والنمو الثقافي.,"Thursday, November 19, 2026","Saturday, November 21, 2026",3,Tier 3,ترفيه,عسير,,أساس,لم تلغى,متواصلة,خلال التواريخ المحددة,تحسب بدون تضمين,Tier 3
,ليالي المكتبات,هيئة المكتبات, تجربة ثقافية فريدة تحتفي بالكتاب والمعرفة وتعــزز دور المكتبـــات في المجتمــع. تقدم الفعاليــة مجموعة من الأنشطــة المتنوعــة بهـدف تشجيـع القـراءة وتعـزيز الوعـي الثقـافي.,"Thursday, December 24, 2026","Saturday, December 26, 2026",3,Tier 3,ترفيه,عسير,,أساس,لم تلغى,متواصلة,خلال التواريخ المحددة,تحسب بدون تضمين,Tier 3
,مارثون الجاكرندا,شركة جوي ريس,"فعالية جري ضمن موسم الجاكرندا تتضمن تنظيم عدة سباقات جري بمسافات مختلفة تناسب جميع المشاركين، حيث تشمل سباق جري لمسافة 2 كيلومتر، وسباق جري لمسافة 10 كيلومترات، بالإضافة إلى سباقات جري لمسافات طويلة تتراوح بين 21 و50 كيلومترًا.","Friday, May 1, 2026","Saturday, May 2, 2026",2,Tier 2,ترفيه,عسير,,أساس,لم تلغى,متواصلة,خلال التواريخ المحددة,تضمن,خارج نطاق 2026
,ملتقى القراءة الدولي,هيئة المكتبات,"منصة ثقافية تهدف إلى دعم مسيرة التحول الوطني من خلال تعزيز مكانة القراءة وترسيخها كقيمة أساسية في المجتمع. يركز الملتقى على إبراز الإبداع السعودي في مجالات الفكر والمعرفة وتعزيز حضور المواهب المحلية في المشهد الثقافي.كما يوفر الملتقى مساحة للتبادل والحوار الثقافي بين متحدثين محليين بما يسهم في توسيع آفاق المعرفة والانفتاح على التجارب وتتنوع الفعاليات لتثري تجربة القراءة لدى مختلف الفئات، بأساليب مبتكرة وجاذبة.","Thursday, October 29, 2026","Saturday, October 31, 2026",3,Tier 3,اعمال,عسير,,أساس,لم تلغى,متواصلة,خلال التواريخ المحددة,تحسب بدون تضمين,Tier 3
,,,,,,,,,,,,,,,,
